{
  "$schema": "http://json-schema.org/draft-07/schema#",
  "title": "Company",
  "type": "object",
  "properties": {
    "company_name": {
      "type": "string",
      "description": "The official name of the company."
    },
    "description": {
      "type": "string",
      "description": "A brief description of the company's mission, values, or key offerings."
    },
    "website": {
      "type": "string",
      "format": "uri",
      "description": "The company's official website URL."
    },
    "poc": {
      "type": "object",
      "properties": {
        "name": {
          "type": "string",
          "description": "The name of the Proof of Concept (PoC)."
        },
        "url": {
          "type": "string",
          "format": "uri",
          "description": "The URL for the company's PoC page."
        }
      },
      "required": ["name", "url"],
      "description": "Details about the company's Proof of Concept (PoC)."
    },
    "email": {
      "type": "string",
      "format": "email",
      "description": "Primary contact email of the company."
    },
    "main_business": {
      "type": "array",
      "items": {
        "type": "string"
      },
      "description": "List of main industries or business activities the company is involved in."
    },
    "index_url": {
      "type": "string",
      "format": "uri",
      "description": "The main index URL for the company's online presence."
    },
    "phone_number": {
      "type": "string",
      "description": "Primary contact phone number of the company."
    },
    "address": {
      "type": "string",
      "description": "The physical address of the company's headquarters."
    },
    "founded_year": {
      "type": "integer",
      "minimum": 1800,
      "maximum": 2100,
      "description": "The year the company was founded."
    },
    "number_of_employees": {
      "type": "integer",
      "minimum": 1,
      "description": "The total number of employees in the company."
    },
    "country": {
      "type": "string",
      "description": "The country where the company is headquartered."
    },
    "social_media": {
      "type": "object",
      "properties": {
        "linkedin": {
          "type": "string",
          "format": "uri",
          "description": "Company's LinkedIn profile URL."
        },
        "twitter": {
          "type": "string",
          "format": "uri",
          "description": "Company's Twitter profile URL."
        },
        "facebook": {
          "type": "string",
          "format": "uri",
          "description": "Company's Facebook page URL."
        }
      },
      "description": "Social media profiles of the company."
    }
  },
  "required": ["company_name", "website", "poc", "email", "main_business", "index_url"]
}
